{
  "schemaVersion": 1,
  "kind": "engineering-process-improvement-resolution",
  "resolvedAt": "2026-08-24T02:00:00Z",
  "signalSha256": "sha256:8c275d5878254215bb5631c0b13ac7e28405b232db07fea4c044f16597a92bb9",
  "dispositionSha256": "sha256:5b614cbed433a426d35373214414f493b83a381f550c73a23f3cd5ab7d2bf716",
  "canonicalInvariantId": "single-windows-helper-protocol",
  "producerLifecycle": {
    "project": "engineering-process",
    "changeId": "close-helper-protocol-recurrence",
    "checkpoint": "cccccccccccccccccccccccccccccccccccccccc",
    "receiptSha256": "sha256:dddddddddddddddddddddddddddddddddddddddddddddddddddddddddddddddd"
  },
  "release": {
    "repository": "example/engineering-process",
    "version": "0.6.0",
    "tag": "v0.6.0",
    "releaseName": "v0.6.0",
    "commit": "eeeeeeeeeeeeeeeeeeeeeeeeeeeeeeeeeeeeeeee",
    "artifactSetSha256": "sha256:0123456789abcdef0123456789abcdef0123456789abcdef0123456789abcdef"
  },
  "regressionEvidence": [
    "sha256:123456789abcdef0123456789abcdef0123456789abcdef0123456789abcdef0",
    "sha256:23456789abcdef0123456789abcdef0123456789abcdef0123456789abcdef01"
  ]
}
